dia;data;horario;nome;descricao
Quarta-feira;2026-03-04;19:30;Culto de Ensino;Estudo bíblico e doutrinário
Sexta-feira;2026-03-06;19:30;Culto de Libertação;Noite de oração e intercessão
Domingo;2026-03-08;09:00;Escola Bíblica Dominical;Estudo da Palavra de Deus
Domingo;2026-03-08;18:00;Culto de Santa Ceia;Repartiremos o pão para recordarmos do sacrificio do cordeiro
Segunda;2026-03-09;19:00;Campanha Circulo de oração;Participaremos de uma campanha com oração, louvor e palavra mas principalmente a presença de Deus!